{
  "$schema": "schemas/native-candidate.schema.json", "schemaVersion": 1, "kind": "hvp-native-candidate", "candidateId": "REPLACE-WITH-RELEASE-CANDIDATE-ID",
  "sourceLockSha256": "REPLACE-WITH-64-LOWERCASE-HEX", "dependencyGraphSha256": "REPLACE-WITH-64-LOWERCASE-HEX", "outputContractSha256": "REPLACE-WITH-64-LOWERCASE-HEX", "bundleDirectory": "bundle",
  "build": { "requestedConfigurationPath": "evidence/requested-configuration.json", "effectiveConfigurationPath": "evidence/effective-configuration.json", "compiledSourcesPath": "evidence/compiled-sources.json", "dependencyPathsPath": "evidence/dependency-paths.json", "dependencyIsolationPath": "evidence/dependency-isolation.json", "toolIdentitiesPath": "evidence/tool-identities.json", "reproducibilityEvidencePath": "evidence/reproducibility.json", "reproducibilityEvidenceSha256": "REPLACE-WITH-64-LOWERCASE-HEX", "reproducibility": { "cleanBuilds": [], "status": "identical", "differenceEvidencePath": null } },
  "sources": [], "binaries": [],
  "peEvidence": { "path": "evidence/pe-evidence.json", "sha256": "REPLACE-WITH-64-LOWERCASE-HEX" }, "smokeEvidence": { "path": "evidence/smoke-matrix.json", "sha256": "REPLACE-WITH-64-LOWERCASE-HEX" },
  "notices": { "path": "THIRD_PARTY_NOTICES.md", "sha256": "REPLACE-WITH-64-LOWERCASE-HEX", "licenseDirectory": "licenses", "licenseFiles": [] },
  "correspondingSource": { "path": "HVP-native-corresponding-source.tar.xz", "sha256": "REPLACE-WITH-64-LOWERCASE-HEX", "archiveInputsPath": "evidence/corresponding-source-inputs.json", "archiveInputsSha256": "REPLACE-WITH-64-LOWERCASE-HEX", "buildInstructionsPath": "BUILD.md", "buildInstructionsSha256": "REPLACE-WITH-64-LOWERCASE-HEX" },
  "sbom": { "path": "HVP-native-sbom.spdx.json", "sha256": "REPLACE-WITH-64-LOWERCASE-HEX", "format": "SPDX-2.3" }, "securityReview": { "path": "evidence/security-review.json", "sha256": "REPLACE-WITH-64-LOWERCASE-HEX" }, "independentReview": { "path": "evidence/independent-review.json", "sha256": "REPLACE-WITH-64-LOWERCASE-HEX" }, "payloadFiles": []
}
